AMO_DRT_NPJ;AMO_DRT_LIB;TEC_COL
0;L'ASSURE N'A PRESENTE AUCUNE PIECE JUSTIFICATIVE;0
1;L'ASSURE A PRESENTE UN BULLETIN DE SALAIRE, UNE ATTESTATION DE DROITS, UNE PRISE EN CHARGE POUR AME,¿;0
2;L'ASSURE A PRESENTE SON ATTESTATION D'OUVERTURE DE DROITS OU LE PARTENAIRE A CONSULTE LE FICHIER PAR TELEMATIQUE;0
3;PRISE EN  CHARGE (CLINIQUES ET CURES THERMALES);0
4;L'ASSURE A PRESENTE SA CARTE VITALE;0
5;LE PARTENAIRE A UTILISE LE TELESERVICE AMO DE REFERENCE (ADRI OU CDRI);0
8;SANS OBJET (RECYCLAGE QF/TP SM / FLUX NX303 < v55.00);0
99;SANS OBJET;2
9;VALEUR INCONNUE;1
