RET_COD;RET_LIB;TEC_COL
70;DIAGNOSTIC ASSOCIÉ SIGNIFICATIF : N'A JAMAIS EXISTÉ DANS LA CIM;0
71;DIAGNOSTIC ASSOCIÉ SIGNIFICATIF: N'EXISTE PLUS DANS LA CIM;0
73;ACTE : N'A JAMAIS EXISTÉ DANS LA CCAM;0
74;ACTE : N'EXISTE PLUS DANS LE CDAM NI DANS LA CCAM;0
76;NUMÉRO D'ENTITE JURIDIQUE NON NUMÉRIQUE;0
77;DATE D'ENTRÉE IMPROBABLE CAR TROP ANCIENNE;0
78;DATE D'ENTREE DU RUM INCOMPATIBLE AVEC UTILISATION D'UN ACTE CCAM;0
79;DATE DE SORTIE DU RUM INCOMPATIBLE AVEC UTILISATION D'UN ACTE CCAM;0
80;GROUPE MÉDICAL OBTENU PAR ÉVITEMENT DU GROUPE 901 (90C01Z);0
81;CODE POSTAL NON NUMÉRIQUE;0
82;POIDS D'ENTRÉE NON NUMÉRIQUE;0
83;ZONE RÉSERVÉE NON VIDE;0
84;DIAGNOSTIC PRINCIPAL INVRAISEMBLABLE CAR RARE;0
85;DIAGNOSTIC PRINCIPAL INVRAISEMBLABLE EN RAISON DE L'ÂGE;0
86;DIAGNOSTIC PRINCIPAL INCOMPATIBLE AVEC LE SEXE INDIQUÉ;0
87;DIAGNOSTIC PRINCIPAL IMPRECIS;0
88;DIAGNOSTIC PRINCIPAL EN « Z » INTERDIT;0
89;DIAGNOSTIC PRINCIPAL DE TYPE DAGUE;0
90;DIAGNOSTIC ASSOCIÉ SIGNIFICATIF INVRAISEMBLABLE CAR RARE;0
91;DIAGNOSTIC ASSOCIÉ SIGNIFICATIF INVRAISEMBLABLE EN RAISON DE L'ÂGE;0
92;DIAGNOSTIC ASSOCIÉ SIGNIFICATIF INCOMPATIBLE AVEC LE SEXE INDIQUÉ;0
93;DIAGNOSTIC ASSOCIÉ SIGNIFICATIF IMPRECIS;0
94;DIAGNOSTIC RELIÉ : N'A JAMAIS EXISTÉ DANS LA CIM;0
95;DIAGNOSTIC RELIÉ : N'EXISTE PLUS DANS LA CIM;0
96;DIAGNOSTIC RELIÉ INVRAISEMBLABLE CAR RARE;0
97;DIAGNOSTIC RELIÉ INVRAISEMBLABLE EN RAISON DE L'ÂGE;0
98;DIAGNOSTIC RELIÉ INCOMPATIBLE AVEC LE SEXE INDIQUÉ;0
99;DIAGNOSTIC RELIÉ IMPRECIS;0
100;TYPE D'AUTORISATION DE L'UNITE MEDICALE INCONNU;0
101;TYPE D'AUTORISATION DE LIT DEDIE INCONNU;0
102;DATE DE REALISATION DE L'ACTE CCAM INCOHERENTE;0
103;CODE D'ACTIVITE DE L'ACTE CCAM NON RENSEIGNE OU VALEUR ERRONEE;0
110;CODE D'ACTIVITE 4 DE L'ACTE CCAM INEXISTANT;0
111;CODE D'ACTIVITE AUTRE QUE 4 DE L'ACTE CCAM INEXISTANT;0
112;GESTE COMPLEMENTAIRE SANS ACTE PRINCIPAL;0
113;CODE INTERDIT EN DP CAR TRES IMPRÉCIS;0
114;CODE INTERDIT EN DP CAR IL S'AGIT D'UNE CAUSE EXTERNE DE MORBIDITÉ (V,W,X,Y);0
115;CODE INTERDIT EN DP CAR IL S'AGIT D'UNE CATÉGORIE NON VIDE OU D'UN CODE PERE INTERDIT;0
116;CODE INTERDIT EN DR CAR TRES IMPRÉCIS;0
117;CODE INTERDIT EN DR CAR IL S'AGIT D'UNE CAUSE EXTERNE DE MORBIDITÉ (V,W,X,Y);0
118;CODE INTERDIT EN DR CAR IL S'AGIT D'UNE CATÉGORIE NON VIDE OU D'UN CODE PERE INTERDIT;0
119;CODE INTERDIT EN DAS CAR IL S'AGIT D'UNE CATÉGORIE NON VIDE OU D'UN CODE PERE INTERDIT;0
999;valeur inconnue;1
888;sans objet;2
0;GROUPAGE REUSSI;0
2;INCOMPATIBILITE SEXE DIAGNOSTIC PRINCIPAL;0
3;DIAGNOSTIC PRINCIPAL INCOHÉRENT;0
4;TABLES ENDOMMAGÉES;0
5;DIAGNOSTIC PRINCIPAL : TITRE, INSUFFISAMMENT PRÉCIS POUR LA CLASSIFICATION DES GHM;0
6;INCOMPATIBILITÉ ACTE DIAGNOSTIC;0
7;POIDS INCOMPATIBLE POUR UN NOUVEAU-NÉ;0
8;CORRUPTION D'UNE TABLE;0
9;TABLE INTROUVABLE;0
10;RSS MULTI-UNITÉ AVEC NUMÉRO DE RSS INCONSTANT;0
11;NUMÉRO DE RSS ABSENT;0
13;DATE DE NAISSANCE ABSENTE;0
14;DATE DE NAISSANCE NON NUMÉRIQUE;0
15;DATE DE NAISSANCE IMPROBABLE PAR RAPPORT À LA DATE D'ENTRÉE;0
16;CODE SEXE ABSENT;0
17;CODE SEXE ERRONÉ;0
19;DATE D'ENTRÉE ABSENTE;0
20;DATE D'ENTRÉE NON NUMÉRIQUE;0
21;DATE D'ENTRÉE INCOHÉRENTE;0
23;RSS MULTI-UNITÉ : CHAÎNAGE DATE D'ENTRÉE   DATE DE SORTIE INCOHÉRENT;0
24;MODE D'ENTRÉE ABSENT;0
25;MODE D'ENTRÉE ERRONÉ OU PROVENANCE ERRONÉE;0
26;MODE D'ENTRÉE INCORRECT OU PROVENANCE INCORRECTE POUR COMMENCER UN RSS;0
27;RSS MULTI-UNITÉ : MODE D'ENTRÉE INCORRECT OU PROVENANCE INCORRECTE SUR UN RUM DE SUITE;0
28;DATE DE SORTIE ABSENTE;0
29;DATE DE SORTIE NON NUMÉRIQUE;0
30;DATE DE SORTIE INCOHÉRENTE;0
32;RUM AVEC INCOHÉRENCE DATE DE SORTIE   DATE D'ENTRÉE;0
33;MODE DE SORTIE ABSENT;0
34;MODE DE SORTIE ERRONÉ, OU DESTINATION ERRONÉE;0
35;MODE DE SORTIE INCORRECT OU DESTINATION INCORRECTE POUR CLORE UN RSS;0
36;NOMBRE DE SÉANCES NON NUMÉRIQUE;0
37;RSS MULTI-UNITÉ : PRÉSENCE DE SÉANCES SUR UN DES RUM;0
39;DATE DE NAISSANCE INCOHÉRENTE;0
40;DIAGNOSTIC PRINCIPAL ABSENT;0
41;CODE DE DIAGNOSTIC PRINCIPAL NE RESPECTANT PAS LE FORMAT DE LA CIM;0
42;CODE DE DIAGNOSTIC ASSOCIÉ SIGNIFICATIF NE RESPECTANT PAS LE FORMAT DE LA CIM;0
43;CODE D'ACTE NE RESPECTANT PAS LE  FORMAT DE LA CCAM;0
45;RSS MULTI-UNITÉ : DATE DE NAISSANCE INCONSTANTE;0
46;RSS MULTI-UNITÉ : CODE SEXE INCONSTANT;0
49;RSS MULTI-UNITÉ : MODE DE SORTIE INCORRECT OU DESTINATION INCORRECTE POUR UN RUM AUTRE QUE LE DERNIER;0
50;DÉLAI DE SÉJOUR INCOMPATIBLE AVEC LE PRINCIPE ADMINISTRATIF DE PRESTATION INTER-ETABLISSEMENT;0
51;CODE DE DIAGNOSTIC RELIÉ NE RESPECTANT PAS LE FORMAT PRÉVU;0
52;NOMBRE DE RÉALISATIONS D'ACTE NON NUMÉRIQUE OU ERRONÉ;0
53;PROVENANCE ABSENTE;0
54;DESTINATION ABSENTE;0
55;NOMBRE DE DAS OU DE DAD ABSENT;0
56;NOMBRE DE DAS OU DE DAD NON NUMÉRIQUE;0
57;NOMBRE D'ACTES ABSENT;0
58;NOMBRE D'ACTES NON NUMÉRIQUE;0
59;FORMAT DE RUM INCONNU;0
61;NUMÉRO DE RSS NON NUMÉRIQUE;0
62;UNITÉ MÉDICALE NON RENSEIGNÉE;0
64;DATE SYSTÈME ANTÉRIEURE À LA DATE D'ENTRÉE;0
65;DATE SYSTÈME ANTÉRIEURE À LA DATE DE SORTIE;0
66;NOMBRE DE SÉANCES : VALEUR INVRAISEMBLABLE;0
67;DIAGNOSTIC PRINCIPAL : N'A JAMAIS EXISTÉ DANS LA CIM;0
68;DIAGNOSTIC PRINCIPAL : N'EXISTE PLUS DANS LA CIM;0
